{
  "$schema": "http://json-schema.org/draft-07/schema#",
  "$id": "wset-ai-system/knowledge-map/causal_chain.schema.json",
  "title": "WSET Knowledge Map — Causal Chain",
  "description": "A structured, multi-step cause-and-effect sequence that traces how one wine factor leads to an outcome through traceable intermediate steps. Causal chains are central to Distinction-level reasoning.",
  "type": "object",
  "required": ["chain_id", "starting_factor", "intermediate_steps", "final_outcome"],
  "additionalProperties": false,
  "properties": {
    "chain_id": {
      "type": "string",
      "description": "Stable unique identifier. Format: CC_{SLUG} — e.g. CC_COOL_CLIMATE_ACIDITY",
      "pattern": "^CC_[A-Z0-9_]+$"
    },
    "chain_name": {
      "type": "string",
      "description": "Short human-readable label for this chain."
    },
    "starting_factor": {
      "type": "object",
      "description": "The initial condition or cause that drives the chain.",
      "required": ["concept_id", "description"],
      "properties": {
        "concept_id": {
          "type": "string",
          "description": "concept_id of the starting factor concept."
        },
        "description": {
          "type": "string",
          "description": "How the starting factor is expressed in this chain."
        }
      }
    },
    "intermediate_steps": {
      "type": "array",
      "description": "Ordered list of intermediate mechanisms between the starting factor and the final outcome. Each step is a link in the causal chain.",
      "minItems": 1,
      "items": {
        "type": "object",
        "required": ["step_number", "concept_id", "description", "relationship_type"],
        "properties": {
          "step_number": {
            "type": "integer",
            "minimum": 1
          },
          "concept_id": {
            "type": "string",
            "description": "concept_id of the concept at this step."
          },
          "description": {
            "type": "string",
            "description": "What happens at this step and why."
          },
          "relationship_type": {
            "type": "string",
            "description": "The type of causal link from the previous step to this one.",
            "enum": ["causes", "influences", "increases", "decreases", "requires", "produces", "reduces", "inhibits"]
          }
        }
      }
    },
    "final_outcome": {
      "type": "object",
      "description": "The end result of the causal chain.",
      "required": ["concept_id", "description"],
      "properties": {
        "concept_id": {
          "type": "string",
          "description": "concept_id of the outcome concept."
        },
        "description": {
          "type": "string",
          "description": "How the outcome manifests in the wine."
        }
      }
    },
    "examples": {
      "type": "array",
      "description": "Real-world wine examples that illustrate this causal chain.",
      "items": {
        "type": "object",
        "required": ["region_or_wine", "description"],
        "properties": {
          "region_or_wine": { "type": "string" },
          "description": { "type": "string" }
        }
      },
      "default": []
    },
    "related_exam_questions": {
      "type": "array",
      "description": "Types or topics of WSET L3 exam questions where understanding this chain is important.",
      "items": { "type": "string" },
      "default": []
    },
    "distinction_note": {
      "type": ["string", "null"],
      "description": "What a Distinction-level answer adds to the description of this chain that a Pass answer would omit.",
      "default": null
    },
    "complexity": {
      "type": "string",
      "description": "How many inferential steps are required to trace this chain fully.",
      "enum": ["simple", "moderate", "complex"]
    },
    "exam_relevance": {
      "type": "string",
      "enum": ["low", "medium", "high", "critical"]
    },
    "tutor_use": {
      "type": "boolean",
      "description": "Whether the Tutor Agent should use this chain in explanations.",
      "default": true
    },
    "examiner_use": {
      "type": "boolean",
      "description": "Whether the Examiner Agent may use this chain. False unless the chain is directly derivable from official WSET sources only.",
      "default": false
    },
    "_meta": {
      "type": "object",
      "properties": {
        "schema_version": { "type": "string" },
        "created_date": { "type": "string", "format": "date" },
        "ingestion_status": {
          "type": "string",
          "enum": ["draft", "review_pending", "approved", "deprecated"]
        }
      }
    }
  }
}
